{
  "$schema": "https://json-schema.org/draft/2020-12/schema",
  "$id": "https://cuebook.xyz/schemas/cuebook-mcp-capability-map-v1.schema.json",
  "type": "object",
  "additionalProperties": false,
  "required": [
    "schema_version",
    "server",
    "module_rules",
    "available_tools",
    "required_tools",
    "planned_tools",
    "skill_tool_policy",
    "frame_publication_flow",
    "release_rules"
  ],
  "properties": {
    "schema_version": {
      "const": "cuebook-mcp-capability-map-v1"
    },
    "server": {
      "type": "object",
      "additionalProperties": false,
      "required": [
        "id",
        "url",
        "transport",
        "authentication"
      ],
      "properties": {
        "id": {
          "type": "string",
          "minLength": 1
        },
        "url": {
          "type": "string",
          "format": "uri"
        },
        "transport": {
          "enum": [
            "http"
          ]
        },
        "authentication": {
          "enum": [
            "oauth"
          ]
        }
      }
    },
    "module_rules": {
      "type": "object",
      "additionalProperties": false,
      "required": [
        "query",
        "create"
      ],
      "properties": {
        "query": {
          "$ref": "#/$defs/moduleRule"
        },
        "create": {
          "$ref": "#/$defs/moduleRule"
        }
      }
    },
    "available_tools": {
      "type": "array",
      "items": {
        "$ref": "#/$defs/tool"
      }
    },
    "required_tools": {
      "type": "array",
      "items": {
        "$ref": "#/$defs/tool"
      }
    },
    "planned_tools": {
      "type": "array",
      "items": {
        "$ref": "#/$defs/plannedTool"
      }
    },
    "skill_tool_policy": {
      "type": "object",
      "additionalProperties": false,
      "required": [
        "default_mode",
        "creator_fast_allowlist",
        "focused_on_demand",
        "deep_only",
        "max_cuebook_batches",
        "max_dependency_followups",
        "web_fallback"
      ],
      "properties": {
        "default_mode": {
          "const": "creator_fast"
        },
        "creator_fast_allowlist": {
          "$ref": "#/$defs/toolNameSet"
        },
        "focused_on_demand": {
          "$ref": "#/$defs/toolNameSet"
        },
        "deep_only": {
          "$ref": "#/$defs/toolNameSet"
        },
        "max_cuebook_batches": {
          "const": 1
        },
        "max_dependency_followups": {
          "const": 1
        },
        "web_fallback": {
          "type": "object",
          "additionalProperties": false,
          "required": [
            "trigger",
            "max_batches",
            "max_queries",
            "max_sources",
            "source_preference",
            "required_lineage_fields",
            "unsupported_claim_policy"
          ],
          "properties": {
            "trigger": {
              "const": "material_gap_after_cuebook_batch"
            },
            "max_batches": {
              "const": 1
            },
            "max_queries": {
              "const": 3
            },
            "max_sources": {
              "const": 3
            },
            "source_preference": {
              "const": "primary_or_authoritative"
            },
            "required_lineage_fields": {
              "const": [
                "retrieved_via",
                "retrieved_at",
                "locator"
              ]
            },
            "unsupported_claim_policy": {
              "const": "creator_hypothesis_or_omit"
            }
          }
        }
      }
    },
    "frame_publication_flow": {
      "type": "object",
      "additionalProperties": false,
      "required": [
        "image_transport",
        "skill_may_pull_media",
        "status_tool",
        "status_returns",
        "explicit_frame_query_tool",
        "automatic_post_publish_readback",
        "publish_success_source",
        "creator_link_policy",
        "published_visual_semantics",
        "client_upload_roles",
        "capture_profiles",
        "native_image_uploads",
        "accepted_mime_types",
        "creator_image_policy",
        "external_artifacts",
        "artifact_hosting_policy",
        "artifact_settlement_independence",
        "subject_assets_policy",
        "delivery_resize_policy",
        "forbidden_tools",
        "initial_publish_sequence",
        "settlement_semantics",
        "settlement_input",
        "reasoning_tags",
        "author_controls",
        "correction_publish_sequence",
        "publish_authorization",
        "prepared_publish_required_fields",
        "prepared_correction_publish_required_fields",
        "wire_golden",
        "mutation_idempotency",
        "replay_policy"
      ],
      "properties": {
        "image_transport": {
          "const": "signed_https_upload_only"
        },
        "skill_may_pull_media": {
          "const": false
        },
        "status_tool": {
          "const": "get_frame_media_status"
        },
        "status_returns": {
          "const": "processing_and_hash_receipts_only"
        },
        "explicit_frame_query_tool": {
          "const": "get_frame"
        },
        "automatic_post_publish_readback": {
          "const": false
        },
        "publish_success_source": {
          "const": "successful_complete_frame_publish_result"
        },
        "creator_link_policy": {
          "const": "never_present_canonical_url"
        },
        "published_visual_semantics": {
          "const": "one_visual_attached_to_frame_release"
        },
        "client_upload_roles": {
          "const": ["publication"]
        },
        "capture_profiles": {
          "const": {"publication": {"width": 1866, "height": 1200}}
        },
        "native_image_uploads": {
          "const": true
        },
        "accepted_mime_types": {
          "const": ["image/png", "image/jpeg", "image/webp"]
        },
        "creator_image_policy": {
          "const": "preserve_native_dimensions_and_aspect_ratio"
        },
        "external_artifacts": {
          "const": true
        },
        "artifact_hosting_policy": {
          "const": "provider_hosted_url_with_immutable_publication_poster"
        },
        "artifact_settlement_independence": {
          "const": true
        },
        "subject_assets_policy": {
          "const": "discovery_only_independent_from_settlement"
        },
        "delivery_resize_policy": {
          "const": "server_generated_web_rendition_only"
        },
        "forbidden_tools": {
          "const": [
            "get_frame_media",
            "list_frame_media",
            "publish_frame_image",
            "share_frame_to_agent"
          ]
        },
        "initial_publish_sequence": {
          "const": [
            "begin_frame_media_upload",
            "https_put_publication_master",
            "complete_frame_media_upload",
            "complete_frame_publish"
          ]
        },
        "settlement_semantics": {
          "const": {
            "non_settling": "none_with_subject_assets_and_no_economic_contract",
            "directional": "long_or_short_with_zero_bps_at_exact_deadline",
            "terminal_range": "range_with_creator_confirmed_max_abs_move_bps_at_exact_deadline",
            "relative_outperformance": "two_distinct_same_session_assets_with_equal_notional_return_spread_at_exact_deadline",
            "compound_conditions": "two_distinct_same_session_assets_with_independent_all_legs_conditions_at_exact_deadline"
          }
        },
        "settlement_input": {
          "const": {
            "envelope": "settlement",
            "non_settling": "{mode:none}",
            "market": "{mode:market,settle_at,timezone,claim_text,rule}",
            "rule_kinds": [
              "single_direction",
              "single_range",
              "relative",
              "compound"
            ]
          }
        },
        "reasoning_tags": {
          "const": {
            "schema_version": "frame-reasoning-tags.v1",
            "mode": "agent_inferred",
            "frontend_managed": false,
            "release_bound": true,
            "max_primary": 1,
            "max_secondary": 2,
            "values": [
              "fundamental",
              "technical",
              "macro_event",
              "flow_positioning",
              "sentiment_narrative"
            ],
            "honest_empty": true,
            "included_in_content_hash": false,
            "included_in_economic_hash": false
          }
        },
        "author_controls": {
          "const": {
            "mcp_managed": false,
            "app_hide_show": true,
            "app_delete_window_seconds": 3600
          }
        },
        "correction_publish_sequence": {
          "const": [
            "prepare_frame_correction_publish",
            "publish_frame_correction"
          ]
        },
        "publish_authorization": {
          "const": "active_oauth_frame_publish_grant_or_explicit_first_party_publish_action"
        },
        "prepared_publish_required_fields": {
          "const": [
            "prepared_hash",
            "publish_token",
            "publish_token_expires_at",
            "preview"
          ]
        },
        "prepared_correction_publish_required_fields": {
          "const": [
            "prepared_hash",
            "publish_token",
            "publish_token_expires_at",
            "preview",
            "base_release_id",
            "expected_economic_hash"
          ]
        },
        "wire_golden": {
          "type": "object",
          "additionalProperties": false,
          "required": [
            "contract_version",
            "tool_count",
            "sync_status",
            "tool_manifest_sha256",
            "schema_catalog_sha256"
          ],
          "properties": {
            "contract_version": {
              "const": "frame-mcp-phase-b-v3"
            },
            "tool_count": {
              "const": 18
            },
            "sync_status": {
              "const": "synced"
            },
            "tool_manifest_sha256": {
              "const": "sha256:416dd4950a9bcbcdc2c73ed9728f7d817ba1d7a574c50b19bbdf88051d648bad"
            },
            "schema_catalog_sha256": {
              "const": "sha256:1b06e0d7ed30da3040f9567b7672791538f82debe51dd727276ea24388138321"
            }
          }
        },
        "mutation_idempotency": {
          "const": "distinct_lowercase_uuidv7_per_command"
        },
        "replay_policy": {
          "const": "same_key_same_payload_returns_receipt_changed_payload_conflict"
        }
      }
    },
    "release_rules": {
      "type": "object",
      "additionalProperties": {
        "type": "boolean"
      }
    },
    "notes": {
      "type": "string",
      "maxLength": 900
    }
  },
  "$defs": {
    "toolNameSet": {
      "type": "array",
      "minItems": 1,
      "uniqueItems": true,
      "items": {
        "type": "string",
        "pattern": "^[a-z0-9_]+$"
      }
    },
    "moduleRule": {
      "type": "object",
      "additionalProperties": false,
      "required": [
        "allowed_access",
        "may_invoke"
      ],
      "properties": {
        "allowed_access": {
          "type": "array",
          "minItems": 1,
          "uniqueItems": true,
          "items": {
            "enum": [
              "read",
              "write",
              "external_write"
            ]
          }
        },
        "may_invoke": {
          "type": "array",
          "uniqueItems": true,
          "items": {
            "enum": [
              "query",
              "create"
            ]
          }
        }
      }
    },
    "tool": {
      "type": "object",
      "additionalProperties": false,
      "required": [
        "tool",
        "module",
        "authorization_scope",
        "access",
        "purpose",
        "used_by"
      ],
      "properties": {
        "tool": {
          "type": "string",
          "pattern": "^[a-z0-9_]+$"
        },
        "module": {
          "enum": [
            "query",
            "create"
          ]
        },
        "authorization_scope": {
          "enum": [
            "read:public",
            "cuebook.paper.read",
            "cuebook.paper.trade",
            "cuebook.frame.read",
            "cuebook.frame.write",
            "cuebook.frame.publish",
            "cuebook.memory.read",
            "cuebook.memory.propose",
            "cuebook.community.publish"
          ]
        },
        "phase": {
          "const": "frame_phase_b"
        },
        "access": {
          "enum": [
            "read",
            "write",
            "external_write"
          ]
        },
        "purpose": {
          "type": "string",
          "minLength": 1
        },
        "input_contract": {
          "type": "string",
          "minLength": 1
        },
        "output_contract": {
          "type": "string",
          "minLength": 1
        },
        "used_by": {
          "type": "array",
          "uniqueItems": true,
          "items": {
            "type": "string",
            "pattern": "^[a-z0-9-]+$"
          }
        },
        "content_kind": {
          "type": "string",
          "maxLength": 40
        },
        "default_enabled": {
          "type": "boolean"
        },
        "source": {
          "type": "string",
          "maxLength": 120
        }
      }
    },
    "plannedTool": {
      "type": "object",
      "additionalProperties": false,
      "required": [
        "tool",
        "module",
        "phase",
        "access",
        "purpose",
        "used_by"
      ],
      "properties": {
        "tool": {
          "type": "string",
          "pattern": "^[a-z0-9_]+$"
        },
        "module": {
          "enum": [
            "query",
            "create"
          ]
        },
        "phase": {
          "const": "planned"
        },
        "access": {
          "enum": [
            "read",
            "write",
            "external_write"
          ]
        },
        "purpose": {
          "type": "string",
          "minLength": 1
        },
        "used_by": {
          "type": "array",
          "uniqueItems": true,
          "items": {
            "type": "string",
            "pattern": "^[a-z0-9-]+$"
          }
        }
      }
    }
  }
}
