{
  "schema_version": "cuebook-mcp-capability-map-v1",
  "server": {
    "id": "cuebook",
    "url": "https://cuebook.app/mcp",
    "transport": "http",
    "authentication": "oauth"
  },
  "module_rules": {
    "query": {
      "allowed_access": [
        "read"
      ],
      "may_invoke": []
    },
    "create": {
      "allowed_access": [
        "read",
        "write",
        "external_write"
      ],
      "may_invoke": [
        "query"
      ]
    }
  },
  "available_tools": [
    {
      "tool": "search_assets",
      "module": "query",
      "authorization_scope": "read:public",
      "access": "read",
      "purpose": "Resolve creator language to a canonical Cuebook asset.",
      "used_by": [
        "query-cuebook",
        "validate-cuebook-projection"
      ]
    },
    {
      "tool": "get_market_state",
      "module": "query",
      "authorization_scope": "read:public",
      "access": "read",
      "purpose": "Bounded latest market snapshot, freshness, and session state per canonical ticker.",
      "used_by": [
        "query-cuebook",
        "build-market-research-pack"
      ]
    },
    {
      "tool": "list_asset_cues",
      "module": "query",
      "authorization_scope": "read:public",
      "access": "read",
      "purpose": "Published Cuebook thesis cards one asset participates in, newest first with keyset cursor.",
      "used_by": [
        "query-cuebook"
      ]
    },
    {
      "tool": "get_cues",
      "module": "query",
      "authorization_scope": "read:public",
      "access": "read",
      "purpose": "Single cue detail with narrative summary and license-gated citations.",
      "used_by": [
        "query-cuebook"
      ]
    },
    {
      "tool": "list_cues_timeline",
      "module": "query",
      "authorization_scope": "read:public",
      "access": "read",
      "purpose": "Platform-wide published thesis cards newest first (discover-equivalent).",
      "used_by": [
        "query-cuebook"
      ]
    },
    {
      "tool": "get_paper_portfolio",
      "module": "query",
      "authorization_scope": "cuebook.paper.read",
      "access": "read",
      "purpose": "User simulated portfolio (cash, equity, positions); source marked SIMULATED.",
      "used_by": [
        "query-cuebook"
      ]
    },
    {
      "tool": "preview_paper_order",
      "module": "query",
      "authorization_scope": "cuebook.paper.trade",
      "access": "read",
      "purpose": "Read-only market-order preview against the persisted price snapshot; never places an order.",
      "used_by": [
        "query-cuebook"
      ]
    },
    {
      "tool": "place_paper_order",
      "module": "create",
      "authorization_scope": "cuebook.paper.trade",
      "access": "write",
      "purpose": "Submit a simulated market order with mandatory idempotency key; grant-scoped attribution.",
      "used_by": [
        "create-cuebook-content"
      ]
    },
    {
      "tool": "close_paper_position",
      "module": "create",
      "authorization_scope": "cuebook.paper.trade",
      "access": "write",
      "purpose": "Reduce-only convenience close of an open simulated position via the same order command path.",
      "used_by": [
        "create-cuebook-content"
      ]
    },
    {
      "tool": "list_paper_orders",
      "module": "query",
      "authorization_scope": "cuebook.paper.read",
      "access": "read",
      "purpose": "User fill history newest first with placedBy attribution.",
      "used_by": [
        "query-cuebook"
      ]
    },
    {
      "tool": "get_candles",
      "module": "query",
      "authorization_scope": "read:public",
      "access": "read",
      "purpose": "Sealed OHLCV history (never the forming tip); prices as decimal strings.",
      "used_by": [
        "query-cuebook",
        "build-market-research-pack",
        "compute-cuebook-market-indicators"
      ],
      "content_kind": "market_history",
      "default_enabled": false
    },
    {
      "tool": "list_market_calendar",
      "module": "query",
      "authorization_scope": "read:public",
      "access": "read",
      "purpose": "Macro and earnings anchors in a bounded lookback/horizon window with revision dedupe.",
      "used_by": [
        "query-cuebook",
        "build-market-research-pack"
      ],
      "content_kind": "calendar",
      "default_enabled": false
    },
    {
      "tool": "list_filings",
      "module": "query",
      "authorization_scope": "read:public",
      "access": "read",
      "purpose": "Surviving filing artifact versions with license-gated evidence and fact attachments.",
      "used_by": [
        "query-cuebook",
        "build-market-research-pack"
      ],
      "content_kind": "filings",
      "default_enabled": false
    },
    {
      "tool": "list_asset_disclosures",
      "module": "query",
      "authorization_scope": "read:public",
      "access": "read",
      "purpose": "Five-provider disclosure co-location records with exact amount payload text.",
      "used_by": [
        "query-cuebook",
        "build-market-research-pack"
      ],
      "content_kind": "market_intel",
      "default_enabled": false
    },
    {
      "tool": "get_positioning",
      "module": "query",
      "authorization_scope": "read:public",
      "access": "read",
      "purpose": "Grounding snapshots per topic: options, crypto derivatives, analyst ratings, leverage ratio.",
      "used_by": [
        "query-cuebook",
        "build-market-research-pack"
      ],
      "content_kind": "market_intel",
      "default_enabled": false
    },
    {
      "tool": "list_asset_events",
      "module": "query",
      "authorization_scope": "read:public",
      "access": "read",
      "purpose": "Token unlocks, onchain security, and breakout events per asset with per-item license tagging.",
      "used_by": [
        "query-cuebook",
        "build-market-research-pack"
      ],
      "content_kind": "market_intel",
      "default_enabled": false
    },
    {
      "tool": "list_prediction_markets",
      "module": "query",
      "authorization_scope": "read:public",
      "access": "read",
      "purpose": "Latest prediction-market snapshots in a clamped 8-day window; resolved markets excluded.",
      "used_by": [
        "query-cuebook",
        "build-market-research-pack"
      ],
      "content_kind": "prediction_market",
      "default_enabled": false
    },
    {
      "tool": "get_news_cluster",
      "module": "query",
      "authorization_scope": "read:public",
      "access": "read",
      "purpose": "Publication-attached membership of one news story with per-member license gate.",
      "used_by": [
        "query-cuebook",
        "build-market-research-pack"
      ],
      "content_kind": "news",
      "default_enabled": false
    },
    {
      "tool": "search_news",
      "module": "query",
      "authorization_scope": "read:public",
      "access": "read",
      "purpose": "Bounded lexical search over Cuebook's ingested news corpus; semantic mode returns a typed unavailable result.",
      "used_by": [
        "query-cuebook",
        "build-market-research-pack"
      ],
      "content_kind": "news",
      "default_enabled": false
    },
    {
      "tool": "list_market_briefings",
      "module": "query",
      "authorization_scope": "read:public",
      "access": "read",
      "purpose": "Published market briefings with fail-closed revision gate; Cuebook interpretation tagged.",
      "used_by": [
        "query-cuebook"
      ],
      "content_kind": "news",
      "default_enabled": false
    },
    {
      "tool": "list_themes",
      "module": "query",
      "authorization_scope": "read:public",
      "access": "read",
      "purpose": "Qualified theme aggregation with 180-day channel disclosure window.",
      "used_by": [
        "query-cuebook"
      ],
      "content_kind": "noesis_research",
      "default_enabled": false
    },
    {
      "tool": "get_cues_detail",
      "module": "query",
      "authorization_scope": "read:public",
      "access": "read",
      "purpose": "Narrative head and legs with optional price reactions; alive+published gate.",
      "used_by": [
        "query-cuebook"
      ],
      "content_kind": "noesis_research",
      "default_enabled": false
    },
    {
      "tool": "get_reasoning_graph",
      "module": "query",
      "authorization_scope": "read:public",
      "access": "read",
      "purpose": "Bounded reasoning graph; judge internals and unpublished lineage never leave.",
      "used_by": [
        "query-cuebook"
      ],
      "content_kind": "noesis_research",
      "default_enabled": false
    },
    {
      "tool": "list_settlements",
      "module": "query",
      "authorization_scope": "read:public",
      "access": "read",
      "purpose": "Settlement outcomes for ever-published narratives (deliberately not alive-gated).",
      "used_by": [
        "query-cuebook",
        "reconcile-market-content-history"
      ],
      "content_kind": "noesis_research",
      "default_enabled": false
    },
    {
      "tool": "get_decision_context",
      "module": "query",
      "authorization_scope": "cuebook.memory.read",
      "access": "read",
      "purpose": "One frozen Decision Context Pack: composable closed lenses over the creator's frozen commitments, execution, outcomes, and memories, with server-computed evidence manifest and per-claim support ceilings.",
      "used_by": [
        "query-cuebook"
      ]
    },
    {
      "tool": "list_memory_items",
      "module": "query",
      "authorization_scope": "cuebook.memory.read",
      "access": "read",
      "purpose": "Inventory of the creator's own candidate and confirmed decision memories; read-only, cursor paged.",
      "used_by": [
        "query-cuebook"
      ]
    },
    {
      "tool": "propose_memory",
      "module": "create",
      "authorization_scope": "cuebook.memory.propose",
      "access": "write",